ID,Language_ID,Primary_Text,Analyzed_Word,Gloss,Translated_Text,Meta_Language_ID,LGR_Conformance,Comment,Media_IDs,Position,Audio_Start,Audio_End,graid,add_orthography,Text_ID
kent02_0557,mcenglish,"And I s-, we used it up to - oh, well we used it all the time we was there - eight years - that were the first year I was over there, I said, I'll never borrow no more tools.",#	and	I	s-	we	used	it	up	to	oh	well	we	used	it	all	the	time	#	we	was	there	%	eight	years	#	that	were	the	first	year	#	I	was	over	there	#	I	said	#	I	='ll	never	borrow	no	more	tools,#	and	I	NC	we	used	it	up	to	oh	well	we	used	it	all	the	time	#	we	was	there	%	eight	years	#	that	were	the	first	year	#	I	was	over	there	#	I	said	#	I	=will	never	borrow	no	more	tools,"And we used it up to - oh, well, we used it all the time we were there - eight years - that was the first year I was over there, when I said, I'll never borrow no more tools.",en,MORPHEME_ALIGNED,,kent02_b_mp3 kent02_b_wav kent02_b_eaf kent02_b_xml kent02_b_tsv,,541640,552786,##	other	nc	nc	nc	nc	nc	nc	nc	other_dp	other_dp	pro.1:a	v:pred	pro:p	ln	ln_det	np:other	#rc	pro.1:s	cop	other:l	%	ln	np:appos	#	dem_pro:s	cop	ln_det	ln	np:pred	#rc	pro.1:s	cop	adp	other:pred_l	#	pro.1:s_ds	v:pred	#ds.neg	pro.1:a	=waux	lv_neg	v:pred	ln	ln	np:p,,kent02
kent02_0558,mcenglish,"I bought a new corn drill, and eh, my old man what was bankrupt, he was going out the farm, he says, First man who'll want to borrow that, he says, Is Paulson.",#	I	bought	a	new	corn drill	#	and	eh	my	old	man	#	what	was	bankrupt	%	he	was	going	out	the	farm	#	he	says	#	first	man	#	who	='ll	want	to	borrow	that	#	he	says	%	is	Paulson,#	I	bought	a	new	corn.drill	#	and	eh	my	old	man	#	what	was	bankrupt	%	he	was	going	out	the	farm	#	he	says	#	first	man	#	who	=will	want	to	borrow	that	#	he	says	%	is	Paulson,"I bought a new corn drill, and my old man, who was bankrupt, he was going out the farm and he said, First man who'll want to borrow that, he said, Is Paulson.",en,MORPHEME_ALIGNED,,kent02_b_mp3 kent02_b_wav kent02_b_eaf kent02_b_xml kent02_b_tsv,,552786,565262,##	pro.1:a	v:pred	ln_deti	ln	np:p	#	other	other_dp	ln_pro.1:poss	ln	np.h:s	#rc	rel_pro.h:s	cop	other:pred	%	pro.h:s	cop	v:pred	adp	ln_det	np:obl	#	pro.h:s_ds	v:pred	#ds	ln	np.h:s	#rc	rel_pro.h:a	=waux	aux	lv_to	v:pred	dem_pro:p	#	pro.h:s_ds	v:pred	%	cop	pn_np.h:pred,,kent02
kent02_0559,mcenglish,That's next door.,#	that	='s	next	door,#	that	=is	next	door,That's next door.,en,MORPHEME_ALIGNED,,kent02_b_mp3 kent02_b_wav kent02_b_eaf kent02_b_xml kent02_b_tsv,,565262,567022,##	dem_pro.h:s	=cop	ln	np:pred_l,,kent02
kent02_0560,mcenglish,Enh.,enh,enh,Enh.,en,MORPHEME_ALIGNED,,kent02_b_mp3 kent02_b_wav kent02_b_eaf kent02_b_xml kent02_b_tsv,,567022,567758,other_dp,,kent02
kent02_0561,mcenglish,"Well, I says, He won't borrow it, 'cause I shan't lend it to him.",#	well	#	I	says	%	he	won't	borrow	it	#	'cause	I	shan't	lend	it	to	him,#	well	#	I	says	%	he	will.NEG	borrow	it	#	because	I	shall.NEG	lend	it	to	him,"Well, I says, He won't borrow it, because I shan't lend it to him.",en,MORPHEME_ALIGNED,,kent02_b_mp3 kent02_b_wav kent02_b_eaf kent02_b_xml kent02_b_tsv,,567758,571123,#ds.neg	other_dp	##	pro.1:s_ds	v:pred	%	pro.h:a	aux_neg	v:pred	pro:p	#ac.neg	other	pro.1:a	aux_neg	v:pred	pro:p	adp	pro.h:g,,kent02
kent02_0562,mcenglish,"And since ever we started putting grey peas in - that's the first thing you put in on a farm - grey peas, in the old days.",#	and	since	ever	we	started	putting	grey	peas	in	#	that	='s	the	first	thing	#	0	you	put	in	on	a	farm	%	grey	peas	in	the	old	days,#	and	since	ever	we	started	putting	grey	peas	in	#	that	=is	the	first	thing	#	0_that	you	put	in	on	a	farm	%	grey	peas	in	the	old	days,"And since ever we started putting grey peas in - that's the first thing you put in on a farm - grey peas, in the old days.",en,MORPHEME_ALIGNED,,kent02_b_mp3 kent02_b_wav kent02_b_eaf kent02_b_xml kent02_b_tsv,,571123,577741,#ac	other	other	other	pro.1:a	aux	v:pred	ln	np:p	rv_adp	#	dem_pro:s	=cop	ln_det	ln	np:pred	#rc	0:p	imp_pro.2:a	v:pred	rv_adp	adp	ln_deti	np:l	%	ln	np:dt_s	adp	ln_det	ln	np:other,,kent02
kent02_0563,mcenglish,Don't grow 'em now.,#	0	don't	grow	='em	now,#	0_you	do.NEG	grow	=them	now,You don't grow 'em now.,en,MORPHEME_ALIGNED,,kent02_b_mp3 kent02_b_wav kent02_b_eaf kent02_b_xml kent02_b_tsv,,577741,579301,##neg	0.2:a	aux_neg	v:pred	=wpro:p	other,,kent02
kent02_0564,mcenglish,"Up come Paulson: Lend us your drill, I want to put my grey peas in. And I was, No, I shan't lend it to you.",#	up	come	Paulson	#	lend	us	your	drill	#	I	want	to	put	my	grey	peas	in	#	and	I	was	#	no	I	shan't	lend	it	to	you,#	up	come	Paulson	#	lend	us	your	drill	#	I	want	to	put	my	grey	peas	in	#	and	I	was	#	no	I	shall.NEG	lend	it	to	you,"Up come Paulson: Lend us your drill, I want to put my grey peas in. And I said, No, I shan't lend it to you.",en,MORPHEME_ALIGNED,,kent02_b_mp3 kent02_b_wav kent02_b_eaf kent02_b_xml kent02_b_tsv,,579301,585662,##	lv_adp	v:pred	pn_np.h:s	#ds	vother:pred	pro.1:obl	ln_pro.2:poss	np:p	#	pro.1:a	v:pred	lv_to	v:other	ln_pro.1:poss	ln	np:p	rv_adp	#	other	pro.1:s_ds	v:pred	#ds.neg	other_dp	pro.1:a	aux_neg	v:pred	pro:p	adp	pro.2:g,,kent02
kent02_0565,mcenglish,"He says, You're a tidy neighbour!",#	he	says	#	you	='re	a	tidy	neighbour,#	he	says	#	you	=are	a	tidy	neighbour,"He says, You're a tidy neighbour!",en,MORPHEME_ALIGNED,,kent02_b_mp3 kent02_b_wav kent02_b_eaf kent02_b_xml kent02_b_tsv,,585662,587854,##	pro.h:s_ds	v:pred	#ds	pro.2:s	=cop	ln_deti	ln	np.h:pred,,kent02
kent02_0566,mcenglish,"That was the first year, see.",#	that	was	the	first	year	see,#	that	was	the	first	year	see,"That was the first year, see.",en,MORPHEME_ALIGNED,,kent02_b_mp3 kent02_b_wav kent02_b_eaf kent02_b_xml kent02_b_tsv,,587854,589067,##	dem_pro:s	cop	ln_det	ln	np:pred	other_dp,,kent02
kent02_0567,mcenglish,"I said, Well, I that'll want doing repairing, I says, In about three years' time, who's going to do it, you?",#	I	said	#	well	I	that	='ll	want	doing	repairing	#	I	says	%	in	about	three	years'	time	#	who	='s	going	to	do	it	you,#	I	said	#	well	I	that	=will	want	doing	repairing	#	I	says	%	in	about	three	years.POSS	time	#	who	=is	going	to	do	it	you,"I said, Well, I that'll want doing repairing, I says, In about three years' time, who's going to do it, you?",en,MORPHEME_ALIGNED,,kent02_b_mp3 kent02_b_wav kent02_b_eaf kent02_b_xml kent02_b_tsv,,589067,595011,##	pro.1:s_ds	v:pred	#ds	other_dp	nc	dem_pro:a	=waux	aux	v:pred	np:p	#	pro.1:s_ds	v:pred	%	adp	adp	ln	ln_np:poss	np:other	#	inter_pro.h:a	=waux	aux	lv_to	v:pred	pro:p	other,,kent02
kent02_0568,mcenglish,"Oh, I don't know.",#	oh	I	don't	know,#	oh	I	do.NEG	know,"Oh, I don't know.",en,MORPHEME_ALIGNED,,kent02_b_mp3 kent02_b_wav kent02_b_eaf kent02_b_xml kent02_b_tsv,,595011,596506,#ds.neg	other_dp	pro.1:a	aux_neg	v:pred,,kent02
kent02_0569,mcenglish,"Well, I said, You can have it.",#	well	#	I	said	%	you	can	have	it,#	well	#	I	said	%	you	can	have	it,"Well, I said, You can have it.",en,MORPHEME_ALIGNED,,kent02_b_mp3 kent02_b_wav kent02_b_eaf kent02_b_xml kent02_b_tsv,,596506,598254,#ds	other_dp	##	pro.1:s_ds	v:pred	%	pro.2:a	aux	v:pred	pro:p,,kent02
kent02_0570,mcenglish,"I said, But it'll cost you shilling an acre.",#	I	said	#	but	it	='ll	cost	you	shilling	an	acre,#	I	said	#	but	it	=will	cost	you	shilling	an	acre,"I said, But it'll cost you shilling an acre.",en,MORPHEME_ALIGNED,,kent02_b_mp3 kent02_b_wav kent02_b_eaf kent02_b_xml kent02_b_tsv,,598254,601528,##	pro.1:s_ds	v:pred	#ds	other	pro:a	=waux	v:pred	pro.2:obl	np:p	rn	rn_np,,kent02
kent02_0571,mcenglish,See?,see,see,See?,en,MORPHEME_ALIGNED,,kent02_b_mp3 kent02_b_wav kent02_b_eaf kent02_b_xml kent02_b_tsv,,601528,602302,other_dp,,kent02
kent02_0572,mcenglish,"And then that'll outdo the repairs, won't it?",#	and	then	that	='ll	outdo	the	repairs	won't	it,#	and	then	that	=will	outdo	the	repairs	will.NEG	it,"And then that'll outdo the repairs, won't it?",en,MORPHEME_ALIGNED,,kent02_b_mp3 kent02_b_wav kent02_b_eaf kent02_b_xml kent02_b_tsv,,602302,604566,##	other	other	dem_pro:a	=waux	v:pred	ln_det	np:p	other_tag	other,,kent02
kent02_0573,mcenglish,"Hhm, You know, I don't want it, he says.",#	hhm	you	know	I	don't	want	it	#	he	says,#	hhm	you	know	I	do.NEG	want	it	#	he	says,"Hhm, You know, I don't want it, he says.",en,MORPHEME_ALIGNED,,kent02_b_mp3 kent02_b_wav kent02_b_eaf kent02_b_xml kent02_b_tsv,,604566,607637,#ds.neg	other_dp	other_dp	other	pro.1:a	aux_neg	v:pred	pro:p	##	pro.h:s_ds	v:pred,,kent02
kent02_0574,mcenglish,So he never come borrowed anything else off me.,#	so	he	never	come	borrowed	anything	else	off	me,#	so	he	never	come	borrowed	anything	else	off	me,So he never come borrowed anything else off me.,en,MORPHEME_ALIGNED,,kent02_b_mp3 kent02_b_wav kent02_b_eaf kent02_b_xml kent02_b_tsv,,607637,609797,##neg	other	pro.h:s	lv_neg	aux	v:pred	indef_pro:p	rn	adp	pro.1:obl,,kent02
kent02_0575,mcenglish,That's how laddie I've been.,#	that	='s	#	how	laddie	I	='ve	been,#	that	=is	#	how	laddie	I	=have	been,That's how laddie I've been.,en,MORPHEME_ALIGNED,,kent02_b_mp3 kent02_b_wav kent02_b_eaf kent02_b_xml kent02_b_tsv,,609797,611753,##	dem_pro:s	=cop	#cc:pred	other	other:pred	pro.1:s	=waux	cop,,kent02
kent02_0576,mcenglish,[INT] Why did you plant grey peas or what were they?,[INT]	why	did	you	plant	grey	peas	or	what	were	they,[INT]	why	did	you	plant	grey	peas	or	what	were	they,[INT] Why did you plant grey peas or what were they?,en,MORPHEME_ALIGNED,,kent02_b_mp3 kent02_b_wav kent02_b_eaf kent02_b_xml kent02_b_tsv,,611753,615662,[INT]	nc	nc	nc	nc	nc	nc	nc	nc	nc	nc,,kent02
kent02_0577,mcenglish,"Eh, just ordinary peas like the peas today, only they were grey peas that we used to feed the sheep with, pigs.",#	eh	0	just	ordinary	peas	like	the	peas	today	#	only	they	were	grey	peas	#	that	we	used	#	to	feed	the	sheep	with	pigs,#	eh	0_they	just	ordinary	peas	like	the	peas	today	#	only	they	were	grey	peas	#	that	we	used	#	to	feed	the	sheep	with	pigs,"Eh, just ordinary peas like the peas today, only they were grey peas that we used to feed the sheep with, pigs.",en,MORPHEME_ALIGNED,,kent02_b_mp3 kent02_b_wav kent02_b_eaf kent02_b_xml kent02_b_tsv,,615662,621171,##	other_dp	0:s	other	ln	np:pred	other	ln_det	np:other	other	#	other	pro:s	cop	ln	np:pred	#rc	rel_pro:p	pro.1:a	v:pred	#ac	lv_to	vother:pred	ln_det	np:p	rv_adp	np:other,,kent02
kent02_0578,mcenglish,Finest thing in the world for little pigs.,#	0	finest	thing	in	the	world	for	little	pigs,#	0_they	finest	thing	in	the	world	for	little	pigs,Finest thing in the world for little pigs.,en,MORPHEME_ALIGNED,,kent02_b_mp3 kent02_b_wav kent02_b_eaf kent02_b_xml kent02_b_tsv,,621171,624004,##	0:s	ln	np:pred	adp	ln_det	np:l	adp	ln	np:obl,,kent02
kent02_0579,mcenglish,"Wean - eh, you know, up to six weeks old.",#	wean	eh	you	know	up	to	six	weeks	old,#	wean	eh	you	know	up	to	six	weeks	old,"Wean - eh, you know, up to six weeks old.",en,MORPHEME_ALIGNED,,kent02_b_mp3 kent02_b_wav kent02_b_eaf kent02_b_xml kent02_b_tsv,,624004,628204,#nc	nc	other_dp	other_dp	other	nc	nc	nc	nc	nc,,kent02
kent02_0580,mcenglish,[INT] Hhm.,[INT]	hhm,[INT]	hhm,[INT] Hhm.,en,MORPHEME_ALIGNED,,kent02_b_mp3 kent02_b_wav kent02_b_eaf kent02_b_xml kent02_b_tsv,,628204,629078,[INT]	nc,,kent02
kent02_0581,mcenglish,Always used to grow a bit of grey peas.,#	0	always	used	to	grow	a	bit	of	grey	peas,#	0_you	always	used	to	grow	a	bit	of	grey	peas,You always used to grow a bit of grey peas.,en,MORPHEME_ALIGNED,,kent02_b_mp3 kent02_b_wav kent02_b_eaf kent02_b_xml kent02_b_tsv,,629078,632674,##	0.2:a	other	aux	rv	v:pred	ln_deti	np:p	rn	rn	rn_np,,kent02
kent02_0582,mcenglish,"[INT] Did your father grow them then, on his farm?",[INT]	did	your	father	grow	them	then	on	his	farm,[INT]	did	your	father	grow	them	then	on	his	farm,"[INT] Did your father grow them then, on his farm?",en,MORPHEME_ALIGNED,,kent02_b_mp3 kent02_b_wav kent02_b_eaf kent02_b_xml kent02_b_tsv,,632674,635707,[INT]	nc	nc	nc	nc	nc	nc	nc	nc	nc,,kent02
kent02_0583,mcenglish,Hhm?,hhm,hhm,Hhm?,en,MORPHEME_ALIGNED,,kent02_b_mp3 kent02_b_wav kent02_b_eaf kent02_b_xml kent02_b_tsv,,635707,636101,other_dp,,kent02
kent02_0584,mcenglish,[INT] Did your father grow them on his farm at Molash?,[INT]	did	your	father	grow	them	on	his	farm	at	Molash,[INT]	did	your	father	grow	them	on	his	farm	at	Molash,[INT] Did your father grow them on his farm at Molash?,en,MORPHEME_ALIGNED,,kent02_b_mp3 kent02_b_wav kent02_b_eaf kent02_b_xml kent02_b_tsv,,636101,637977,[INT]	nc	nc	nc	nc	nc	nc	nc	nc	nc	nc,,kent02
kent02_0585,mcenglish,"No, he didn't.",#	no	he	did	=n't	0	0,#	no	he	did	=NEG	0_do	0_that,"No, he didn't.",en,MORPHEME_ALIGNED,,kent02_b_mp3 kent02_b_wav kent02_b_eaf kent02_b_xml kent02_b_tsv,,637977,639247,##neg	other_dp	pro.h:a	aux	=neg	0:pred	0:p,,kent02
kent02_0586,mcenglish,Only had a bit of oats.,#	0	only	had	a	bit	of	oats,#	0_he	only	had	a	bit	of	oats,Only had a bit of oats.,en,MORPHEME_ALIGNED,,kent02_b_mp3 kent02_b_wav kent02_b_eaf kent02_b_xml kent02_b_tsv,,639247,641021,##	0.h:a	other	v:pred	ln_deti	np:p	rn	rn_np,,kent02
kent02_0587,mcenglish,"No, he just growed oats for his horses, see.",#	no	he	just	growed	oats	for	his	horses	see,#	no	he	just	growed	oats	for	his	horses	see,"No, he just grew oats for his horses, see.",en,MORPHEME_ALIGNED,,kent02_b_mp3 kent02_b_wav kent02_b_eaf kent02_b_xml kent02_b_tsv,,641021,643370,##	other_dp	pro.h:a	other	v:pred	np:p	adp	ln_pro.h:poss	np:obl	other_dp,,kent02
kent02_0588,mcenglish,[INT] What did he feed his pigs on then?,[INT]	what	did	he	feed	his	pigs	on	then,[INT]	what	did	he	feed	his	pigs	on	then,[INT] What did he feed his pigs on then?,en,MORPHEME_ALIGNED,,kent02_b_mp3 kent02_b_wav kent02_b_eaf kent02_b_xml kent02_b_tsv,,643370,645558,[INT]	nc	nc	nc	nc	nc	nc	nc	nc,,kent02
kent02_0589,mcenglish,"Old miller used to come round with old horse and cart, and a bag of sharps, seven bob.",#	old	miller	used	to	come	round	with	old	horse	and	cart	and	a	bag	of	sharps	seven	bob,#	old	miller	used	to	come	round	with	old	horse	and	cart	and	a	bag	of	sharps	seven	bob,"The old miller used to come around with his old horse and cart, and a bag of sharps, for seven bob.",en,MORPHEME_ALIGNED,,kent02_b_mp3 kent02_b_wav kent02_b_eaf kent02_b_xml kent02_b_tsv,,645558,651974,##	ln	np.h:s	aux	rv	v:pred	rv_adp	adp	ln	np:obl	rn	rn_np	rn	rn_deti	rn	rn	rn_np	ln	np:other,,kent02
kent02_0590,mcenglish,"Or middlings, they call'em now, don't they; we used to call'em sharps.",#	or	middlings	they	call	='em	now	don't	they	#	we	used	to	call	='em	sharps,#	or	middlings	they	call	=them	now	do.NEG	they	#	we	used	to	call	=them	sharps,"Or middlings, they call'em now, don't they; we used to call'em sharps.",en,MORPHEME_ALIGNED,,kent02_b_mp3 kent02_b_wav kent02_b_eaf kent02_b_xml kent02_b_tsv,,651974,655774,##	other	np:dt_p	pro.h:a	v:pred	=wpro:p	other	other_tag	other	#	pro.1:a	aux	rv	v:pred	=wpro:p	np:p2,,kent02
kent02_0591,mcenglish,"Barley meal, that was about eight bob, hundredweight, already ground delivered.",#	barley meal	that	was	about	eight	bob	hundredweight	#	already	ground	delivered,#	barley.meal	that	was	about	eight	bob	hundredweight	#	already	ground	delivered,"Barley meal, that was about eight bob, hundredweight, delivered already ground.",en,MORPHEME_ALIGNED,,kent02_b_mp3 kent02_b_wav kent02_b_eaf kent02_b_xml kent02_b_tsv,,655774,664247,##	np:dt_s	dem_pro:s	cop	adp	ln	np:pred	other	#	other	other	vother:pred,,kent02
kent02_0592,mcenglish,Hhm.,hhm,hhm,Hhm.,en,MORPHEME_ALIGNED,,kent02_b_mp3 kent02_b_wav kent02_b_eaf kent02_b_xml kent02_b_tsv,,664247,665971,other_dp,,kent02
kent02_0593,mcenglish,"Always used to grow mangel for the old sows; these wurzel, you know what a mangel-wurzel is, he used to give them to the old sows.",#	0	always	used	to	grow	mangel	for	the	old	sows	#	these	wurzel	#	you	know	#	what	a	mangel-wurzel	is	%	he	used	to	give	them	to	the	old	sows,#	0_he	always	used	to	grow	mangel	for	the	old	sows	#	these	wurzel	#	you	know	#	what	a	mangel-wurzel	is	%	he	used	to	give	them	to	the	old	sows,"He always used to grow mangel for the old sows; these wurzel, you know what a mangel-wurzel is, he used to give them to the old sows.",en,MORPHEME_ALIGNED,,kent02_b_mp3 kent02_b_wav kent02_b_eaf kent02_b_xml kent02_b_tsv,,665971,673604,##	0.h:a	other	aux	rv	v:pred	np:p	adp	ln_det	ln	np:obl	#	ln_dem	np:dt_p	#	pro.2:a	v:pred	#cc:p	other:pred	ln_deti	np:s	cop	%	pro.h:a	aux	rv	v:pred	pro:p	adp	ln_det	ln	np:g,,kent02
kent02_0594,mcenglish,The sheep.,#	the	sheep,#	the	sheep,The sheep.,en,MORPHEME_ALIGNED,,kent02_b_mp3 kent02_b_wav kent02_b_eaf kent02_b_xml kent02_b_tsv,,673604,675918,#nc	nc	nc,,kent02
kent02_0595,mcenglish,"Horses, ooh, they love them, horses do.",#	horses	ooh	they	love	them	#	horses	do	0,#	horses	ooh	they	love	them	#	horses	do	0_that,"Horses, ooh, they love them, horses do.",en,MORPHEME_ALIGNED,,kent02_b_mp3 kent02_b_wav kent02_b_eaf kent02_b_xml kent02_b_tsv,,675918,678876,##	np:dt_a	other_dp	pro:a	v:pred	pro:p	#	np:a	v:pred	0:p,,kent02
kent02_0596,mcenglish,"Oh, they do love them.",#	oh	they	do	love	them,#	oh	they	do	love	them,"Oh, they do love them.",en,MORPHEME_ALIGNED,,kent02_b_mp3 kent02_b_wav kent02_b_eaf kent02_b_xml kent02_b_tsv,,678876,680704,##	other_dp	pro:a	aux	v:pred	pro:p,,kent02
kent02_0597,mcenglish,"If you, we've had, I've gone in and the old horses got used to having one; we give them one a day, see - just for a relish.",#	if	you	we	='ve	had	I	='ve	gone	in	#	and	the	old	horses	got	used	to	#	having	one	#	we	give	them	one	a	day	see	just	for	a	relish,#	if	you	we	=have	had	I	=have	gone	in	#	and	the	old	horses	got	used	to	#	having	one	#	we	give	them	one	a	day	see	just	for	a	relish,"I've gone in and the old horses got used to having one; we gave them one a day, see - just for a relish.",en,MORPHEME_ALIGNED,,kent02_b_mp3 kent02_b_wav kent02_b_eaf kent02_b_xml kent02_b_tsv,,680704,689916,##	nc	nc	nc	nc	nc	pro.1:s	=waux	v:pred	rv_adp	#	other	ln_det	ln	np:s	aux	v:pred	rv	#cc:obl	vother:pred	np:p	#	pro.1:a	v:pred	pro:p	np:p2	adp	np:other	other_dp	other	adp	ln_deti	np:other,,kent02
kent02_0598,mcenglish,"And if they hear you chuck one up in the manger, the others holler like hell.",#	and	if	they	hear	#	you	chuck	one	up	in	the	manger	#	the	others	holler	like	hell,#	and	if	they	hear	#	you	chuck	one	up	in	the	manger	#	the	others	holler	like	hell,"And if they hear you chuck one up in the manger, the others holler like hell.",en,MORPHEME_ALIGNED,,kent02_b_mp3 kent02_b_wav kent02_b_eaf kent02_b_xml kent02_b_tsv,,689916,694622,#ac	other	other	pro:a	v:pred	#cc:p	imp_pro.2:ncs	v:pred	np:p	adp	adp	ln_det	np:g	##	ln_det	np:s	v:pred	other	np:other,,kent02
kent02_0599,mcenglish,"You know, they want theirs.",#	you	know	they	want	theirs	0,#	you	know	they	want	theirs	0_wurzel,"You know, they want theirs.",en,MORPHEME_ALIGNED,,kent02_b_mp3 kent02_b_wav kent02_b_eaf kent02_b_xml kent02_b_tsv,,694622,699630,##	other_dp	other	pro:a	v:pred	pro:poss	0:p,,kent02
kent02_0600,mcenglish,Hhm.,hhm,hhm,Hhm.,en,MORPHEME_ALIGNED,,kent02_b_mp3 kent02_b_wav kent02_b_eaf kent02_b_xml kent02_b_tsv,,699630,701764,other_dp,,kent02
kent02_0601,mcenglish,Go-,go,go,Go-,en,MORPHEME_ALIGNED,,kent02_b_mp3 kent02_b_wav kent02_b_eaf kent02_b_xml kent02_b_tsv,,701764,703637,other_dp,,kent02
kent02_0602,mcenglish,[INT] Hhm. Wasn't keeping pigs a risky business?,[INT]	hhm	was	=n't	keeping	pigs	a	risky	business,[INT]	hhm	was	=NEG	keeping	pigs	a	risky	business,[INT] Hhm. Wasn't keeping pigs a risky business?,en,MORPHEME_ALIGNED,,kent02_b_mp3 kent02_b_wav kent02_b_eaf kent02_b_xml kent02_b_tsv,,703637,705786,[INT]	nc	nc	nc	nc	nc	nc	nc	nc,,kent02
kent02_0603,mcenglish,Hhm?,hhm,hhm,Hhm?,en,MORPHEME_ALIGNED,,kent02_b_mp3 kent02_b_wav kent02_b_eaf kent02_b_xml kent02_b_tsv,,705786,706280,other_dp,,kent02
kent02_0604,mcenglish,[INT] Was keeping pigs a risky business?,[INT]	was	keeping	pigs	a	risky	business,[INT]	was	keeping	pigs	a	risky	business,[INT] Was keeping pigs a risky business?,en,MORPHEME_ALIGNED,,kent02_b_mp3 kent02_b_wav kent02_b_eaf kent02_b_xml kent02_b_tsv,,706280,708235,[INT]	nc	nc	nc	nc	nc	nc,,kent02
kent02_0605,mcenglish,"Ooh, we never had swine fever.",#	ooh	we	never	had	swine fever,#	ooh	we	never	had	swine.fever,"Ooh, we never had swine fever.",en,MORPHEME_ALIGNED,,kent02_b_mp3 kent02_b_wav kent02_b_eaf kent02_b_xml kent02_b_tsv,,708235,711686,##neg	other_dp	pro.1:a	lv_neg	v:pred	np:p,,kent02
kent02_0606,mcenglish,"I don't think there was, I don't think I can ever remember swine fever.",#	I	don't	think	#	there	was	0	#	I	don't	think	#	I	can	ever	remember	swine fever,#	I	do.NEG	think	#	there	was	0_it	#	I	do.NEG	think	#	I	can	ever	remember	swine.fever,"I don't think there was, I don't think I can ever remember swine fever.",en,MORPHEME_ALIGNED,,kent02_b_mp3 kent02_b_wav kent02_b_eaf kent02_b_xml kent02_b_tsv,,711686,720013,##neg	pro.1:a	aux_neg	v:pred	#cc:p	other	other:predex	0:s	#neg	pro.1:a	aux_neg	v:pred	#cc:p	pro.1:a	aux	other	v:pred	np:p,,kent02
kent02_0607,mcenglish,We never had it.,#	we	never	had	it,#	we	never	had	it,We never had it.,en,MORPHEME_ALIGNED,,kent02_b_mp3 kent02_b_wav kent02_b_eaf kent02_b_xml kent02_b_tsv,,720013,724226,##neg	pro.1:a	lv_neg	v:pred	pro:p,,kent02
kent02_0608,mcenglish,Let me think there.,#	let	me	think	there,#	let	me	think	there,Let me think there.,en,MORPHEME_ALIGNED,,kent02_b_mp3 kent02_b_wav kent02_b_eaf kent02_b_xml kent02_b_tsv,,724226,727966,##	vother:pred	pro.1:obl	vother:other	other,,kent02
kent02_0609,mcenglish,There was a case in Boughton,#	there	was	a	case	in	Boughton,#	there	was	a	case	in	Boughton,There was a case in Boughton,en,MORPHEME_ALIGNED,,kent02_b_mp3 kent02_b_wav kent02_b_eaf kent02_b_xml kent02_b_tsv,,727966,732014,##	other	other:predex	ln_deti	np:s	adp	pn_np:l,,kent02
kent02_0610,mcenglish,I don't know whether that was swine fever or whether it wadn't.,#	I	don't	know	#	whether	that	was	swine fever	#	or	whether	it	wad	=n't	0,#	I	do.NEG	know	#	whether	that	was	swine.fever	#	or	whether	it	was	=NEG	0_that,I don't know whether that was swine fever or whether it wasn't.,en,MORPHEME_ALIGNED,,kent02_b_mp3 kent02_b_wav kent02_b_eaf kent02_b_xml kent02_b_tsv,,732014,737078,##neg	pro.1:a	aux_neg	v:pred	#cc:p	other	dem_pro:s	cop	np:pred	#cc.neg:p	other	other	pro:s	aux	=neg	0:pred,,kent02
kent02_0611,mcenglish,"It was closed, we went along there one day and the police told us we got to go some other way, 'cause there was something, I think, I don't know, or it may have been swine fever.",#	it	was	closed	#	we	went	along	there	one	day	#	and	the	police	told	us	#	we	got	to	go	some	other	way	#	'cause	there	was	something	#	I	think	0	#	I	don't	know	#	or	it	may	have	been	swine fever,#	it	was	closed	#	we	went	along	there	one	day	#	and	the	police	told	us	#	we	got	to	go	some	other	way	#	because	there	was	something	#	I	think	0_that	#	I	do.NEG	know	#	or	it	may	have	been	swine.fever,"It was closed, we went along there one day and the police told us we got to go some other way, because there was something, I think, I don't know, it may have been swine fever.",en,MORPHEME_ALIGNED,,kent02_b_mp3 kent02_b_wav kent02_b_eaf kent02_b_xml kent02_b_tsv,,737078,747445,##	pro:s	aux	v:pred	#	pro.1:s	v:pred	adp	other:l	ln_deti	np:other	#	other	ln_det	np.h:a	v:pred	pro.1:g	#cc:p	pro.1:s	aux	lv_to	v:pred	ln_deti	ln	np:l	#ac	other	other	other:predex	indef_pro:s	#	pro.1:a	v:pred	0:p	#neg	pro.1:s	aux_neg	v:pred	#	other	pro:s	aux	aux	cop	np:pred,,kent02
kent02_0612,mcenglish,I don't know.,#	I	don't	know,#	I	do.NEG	know,I don't know.,en,MORPHEME_ALIGNED,,kent02_b_mp3 kent02_b_wav kent02_b_eaf kent02_b_xml kent02_b_tsv,,747445,749925,##neg	pro.1:s	aux_neg	v:pred,,kent02
kent02_0613,mcenglish,"They, they eh, if you had anything the matter with the pig, eh, you had to notify the ministry, you know.",#	they	they	eh	if	you	had	anything	the	matter	with	the	pig	#	eh	you	had	to	notify	the	ministry	you	know,#	they	they	eh	if	you	had	anything	the	matter	with	the	pig	#	eh	you	had	to	notify	the	ministry	you	know,"If you had anything the matter with the pig, you had to notify the ministry, you know.",en,MORPHEME_ALIGNED,,kent02_b_mp3 kent02_b_wav kent02_b_eaf kent02_b_xml kent02_b_tsv,,749925,760359,#ac	nc	nc	other_dp	other	imp_pro.2:a	v:pred	indef_pro:p	rn	rn_np	adp	ln_det	np:obl	#	other_dp	imp_pro.2:a	aux	lv_to	v:pred	ln_det	np:p	other_dp	other,,kent02
kent02_0614,mcenglish,"And eh, we'd got an old sow.",#	and	eh	we	='d	got	an	old	sow,#	and	eh	we	=had	got	an	old	sow,And we'd got an old sow.,en,MORPHEME_ALIGNED,,kent02_b_mp3 kent02_b_wav kent02_b_eaf kent02_b_xml kent02_b_tsv,,760359,764449,##	other	other_dp	pro.1:a	=waux	v:pred	ln_deti	ln	np:p,,kent02
kent02_0615,mcenglish,[INT] When is this? Is it-,[INT]	when	is	this	is	it,[INT]	when	is	this	is	it,[INT] When is this? Is it-,en,MORPHEME_ALIGNED,,kent02_b_mp3 kent02_b_wav kent02_b_eaf kent02_b_xml kent02_b_tsv,,764449,766056,[INT]	nc	nc	nc	nc	nc,,kent02
kent02_0616,mcenglish,"Oh, this is going back now, when I, when I, I was at home from that war - home from the army.",#	oh	this	is	going	back	now	#	when	I	when	I	I	was	at	home	from	that	war	home	from	the	army,#	oh	this	is	going	back	now	#	when	I	when	I	I	was	at	home	from	that	war	home	from	the	army,"Oh, this is going back now, when I was at home from that war - home from the army.",en,MORPHEME_ALIGNED,,kent02_b_mp3 kent02_b_wav kent02_b_eaf kent02_b_xml kent02_b_tsv,,766056,773686,##	other_dp	dem_pro:s	aux	v:pred	rv_adp	other	#ac	nc	nc	other	nc	pro.1:s	cop	adp	other:pred_l	adp	ln_dem	np:obl	other	other	other	other,,kent02
kent02_0617,mcenglish,I was seventeen then.,#	I	was	seventeen	then,#	I	was	seventeen	then,I was seventeen then.,en,MORPHEME_ALIGNED,,kent02_b_mp3 kent02_b_wav kent02_b_eaf kent02_b_xml kent02_b_tsv,,773686,775430,##	pro.1:s	cop	np:pred	other,,kent02
