ID,Language_ID,Primary_Text,Analyzed_Word,Gloss,Translated_Text,Meta_Language_ID,LGR_Conformance,Comment,Media_IDs,Position,Audio_Start,Audio_End,graid,add_orthography,Text_ID
kent01_0326,mcenglish,"My father used to come home from at Canterbury Market, or from town, with a little old paper, he give a penny for, so's I could read out to him what happened in the Boer War.",#	my	father	used	to	come	home	from	at	Canterbury Market	or	from	town	with	a	little	old	paper	#	he	give	a	penny	for	#	so='s	I	could	read	out	to	him	#	what	happened	in	the	Boer War,#	my	father	used	to	come	home	from	at	Canterbury.Market	or	from	town	with	a	little	old	paper	#	he	give	a	penny	for	#	so=that	I	could	read	out	to	him	#	what	happened	in	the	Boer.War,"My father used to come home from Canterbury Market or from town, with a little old paper, he'd give a penny for, so that I could read out to him what happened in the Boer War.",en,MORPHEME_ALIGNED,,kent01_mp3 kent01_wav kent01_eaf kent01_xml kent01_tsv,,1606074,1621417,##	ln_pro.1:poss	np.h:s	aux	rv	v:pred	rv	adp	adp	pn_np:obl	other	adp	np:obl	adp	ln_deti	ln	ln	np:obl	#rc	pro.h:a	v:pred	ln_deti	np:p	rv	##	other=other	pro.1:a	aux	v:pred	rv	adp	pro.h:g	#cc:p	other:s	v:pred	adp	ln_det	pn_np:l,,kent01
kent01_0327,mcenglish,I can remember that as well...,#	I	can	remember	that	as	well,#	I	can	remember	that	as	well,I can remember that as well...,en,MORPHEME_ALIGNED,,kent01_mp3 kent01_wav kent01_eaf kent01_xml kent01_tsv,,1621417,1626089,##	pro.1:a	aux	v:pred	dem_pro:p	other	other,,kent01
kent01_0328,mcenglish,[INT] Did he ever keep any records of his dealings then? Your father?,[INT]	did	he	ever	keep	any	records	of	his	dealings	then	your	father,[INT]	did	he	ever	keep	any	records	of	his	dealings	then	your	father,[INT] Did your father ever keep any records of his dealings then?,en,MORPHEME_ALIGNED,,kent01_mp3 kent01_wav kent01_eaf kent01_xml kent01_tsv,,1626089,1630522,[INT]	nc	nc	nc	nc	nc	nc	nc	nc	nc	nc	nc	nc,,kent01
kent01_0329,mcenglish,"My father, never, no - how could he? Only here.",#	my	father	never	no	#	how	could	he	#	only	here,#	my	father	never	no	#	how	could	he	#	only	here,"My father, never, no - how could he? Only here.",en,MORPHEME_ALIGNED,,kent01_mp3 kent01_wav kent01_eaf kent01_xml kent01_tsv,,1630522,1633985,#nc	nc	nc	nc	nc	#nc	nc	nc	nc	#nc	nc	nc,,kent01
kent01_0330,mcenglish,[INT] In his head.,[INT]	in	his	head,[INT]	in	his	head,[INT] In his head.,en,MORPHEME_ALIGNED,,kent01_mp3 kent01_wav kent01_eaf kent01_xml kent01_tsv,,1633985,1634880,[INT]	nc	nc	nc,,kent01
kent01_0331,mcenglish,Yeah.,yeah,yeah,Yeah.,en,MORPHEME_ALIGNED,,kent01_mp3 kent01_wav kent01_eaf kent01_xml kent01_tsv,,1634880,1635431,other_dp,,kent01
kent01_0332,mcenglish,[INT] Hhm.,[INT]	hhm,[INT]	hhm,[INT] Hhm.,en,MORPHEME_ALIGNED,,kent01_mp3 kent01_wav kent01_eaf kent01_xml kent01_tsv,,1635431,1636070,[INT]	nc,,kent01
kent01_0333,mcenglish,"That's where I kept mine, until it got so big; then I used to have a Collin's notebook.",#	that='s	#	where	I	kept	mine	0	#	until	it	got	so	big	#	then	I	used	to	have	a	Collin's notebook,#	that=is	#	where	I	kept	mine	0_records	#	until	it	got	so	big	#	then	I	used	to	have	a	Collin's.notebook,"That's where I kept mine, until it got so big; then I used to have a Collin's notebook.",en,MORPHEME_ALIGNED,,kent01_mp3 kent01_wav kent01_eaf kent01_xml kent01_tsv,,1636070,1644556,##	dem_pro:s=cop	#cc:p	other:l	pro.1:a	v:pred	pro.1:poss	0:p	#ac	other	pro:s	cop	other	other:pred	#	other	pro.1:a	aux	rv	v:pred	ln_deti	np:p,,kent01
kent01_0334,mcenglish,"Ooh, that's on here.",#	ooh	that='s	on	here,#	ooh	that=is	on	here,"Ooh, that's on here.",en,MORPHEME_ALIGNED,,kent01_mp3 kent01_wav kent01_eaf kent01_xml kent01_tsv,,1644556,1646651,##	nc	dem_pro:s=cop	adp	other:pred_l,,kent01
kent01_0335,mcenglish,Oh -,oh,oh,Oh -,en,MORPHEME_ALIGNED,,kent01_mp3 kent01_wav kent01_eaf kent01_xml kent01_tsv,,1646651,1648175,other_dp,,kent01
kent02_0001,mcenglish,[INT] Okay. We're on.,[INT]	okay	we	='re	on,[INT]	okay	we	=are	on,[INT] Okay. We're on.,en,MORPHEME_ALIGNED,,kent02_a_mp3 kent02_a_wav kent02_a_eaf kent02_a_xml kent02_a_tsv,,0,2310,[INT]	nc	nc	nc	nc,,kent02
kent02_0002,mcenglish,Heh?,heh,heh,Heh?,en,MORPHEME_ALIGNED,,kent02_a_mp3 kent02_a_wav kent02_a_eaf kent02_a_xml kent02_a_tsv,,2310,2882,other_dp,,kent02
kent02_0003,mcenglish,[INT] We're on now.,[INT]	we	='re	on	now,[INT]	we	=are	on	now,[INT] We're on now.,en,MORPHEME_ALIGNED,,kent02_a_mp3 kent02_a_wav kent02_a_eaf kent02_a_xml kent02_a_tsv,,2882,3710,[INT]	nc	nc	nc	nc,,kent02
kent02_0004,mcenglish,"I say, there was a lot of gypsies about the place.",#	I	say	#	there	was	a	lot	of	gypsies	about	the	place,#	I	say	#	there	was	a	lot	of	gypsies	about	the	place,"I say, there were a lot of gypsies about the place.",en,MORPHEME_ALIGNED,,kent02_a_mp3 kent02_a_wav kent02_a_eaf kent02_a_xml kent02_a_tsv,,3710,6560,##	pro.1:s_ds	v:pred	#ds	other	other:predex	ln_deti	np:pred	rn	rn_np.h	adp	ln_det	np:l,,kent02
kent02_0005,mcenglish,"And eh, they used to come around to the back doors, to every cottage and sell these old pegs, made out of hazel twig.",#	and	eh	they	used	to	come	around	to	the	back doors	to	every	cottage	#	and	0	sell	these	old	pegs	#	made	out	of	hazel twig,#	and	eh	they	used	to	come	around	to	the	back.doors	to	every	cottage	#	and	0_they	sell	these	old	pegs	#	made	out	of	hazel.twig,"And they used to come around to the back doors, to every cottage, and sell these old pegs made out of hazel twig.",en,MORPHEME_ALIGNED,,kent02_a_mp3 kent02_a_wav kent02_a_eaf kent02_a_xml kent02_a_tsv,,6560,14909,##	other	other_dp	pro.h:s	aux	rv	v:pred	adp	adp	ln_det	np:g	adp	ln	np:g	#	other	0.h:a	v:pred	ln_dem	ln	np:p	#rc	vother:pred	adp	adp	np:other,,kent02
kent02_0006,mcenglish,"They used to make'em and sell'em sh- about tuppence a dozen, and what the women used to peg their clothes with, you see; you've seen them, ain't you?",#	they	used	to	make	='em	#	and	0	sell	='em	sh-	about	tuppence	a	dozen	and	#	what	the	women	used	#	to	peg	their	clothes	with	you	see	#	you	='ve	seen	them	ain't	you,#	they	used	to	make	=them	#	and	0_they	sell	=them	sh-	about	tuppence	a	dozen	and	#	what	the	women	used	#	to	peg	their	clothes	with	you	see	#	you	=have	seen	them	have.NEG	you,"They used to make'em and sell'em about tuppence a dozen, and they were what the women used to peg their clothes with, you see; you've seen them, haven't you?",en,MORPHEME_ALIGNED,,kent02_a_mp3 kent02_a_wav kent02_a_eaf kent02_a_xml kent02_a_tsv,,14909,25924,##	pro.h:a	aux	rv_to	v:pred	=wpro:p	#	other	0.h:a	v:pred	=wpro:p	nc	adp	np:obl	rn_adp	rn_np	other	#cc:p	other:p	ln_det	np.h:a	v:pred	#ac	lv_to	vother:pred	ln_pro.h:poss	np:p	adp	other_dp	other_dp	#	pro.2:a	=waux	v:pred	pro:p	other_tag	other,,kent02
kent02_0007,mcenglish,[INT] Hhm.,[INT]	hhm,[INT]	hhm,[INT] Hhm.,en,MORPHEME_ALIGNED,,kent02_a_mp3 kent02_a_wav kent02_a_eaf kent02_a_xml kent02_a_tsv,,25924,26294,[INT]	nc,,kent02
kent02_0008,mcenglish,"Well, they, I had eczema when I was eight, in mi eye, that eye; that's what made that, pulled it one side.",#	well	they	I	had	eczema	#	when	I	was	eight	in	mi	eye	that	eye	#	that	='s	#	what	made	that	#	0	pulled	it	one	side,#	well	they	I	had	eczema	#	when	I	was	eight	in	mi	eye	that	eye	#	that	=is	#	what	made	that	#	0_it	pulled	it	one	side,"Well, I had eczema when I was eight, in my eye, that eye; that's what made that, pulled it one side.",en,MORPHEME_ALIGNED,,kent02_a_mp3 kent02_a_wav kent02_a_eaf kent02_a_xml kent02_a_tsv,,26294,34529,##	other_dp	nc	pro.1:a	v:pred	np:p	#ac	other	pro.1:s	cop	np:pred	adp	ln_pro.1:poss	np:l	ln_dem	np:appos	#	dem_pro:s	=cop	#cc:pred	other:a	v:pred	dem_pro:p	#	0:a	v:pred	pro:p	ln_deti	np:g,,kent02
kent02_0009,mcenglish,"And eh, the doctor couldn't seem to, give us a lot of ointments and one thing and other, and he couldn't see, seem to do it any good.",#	and	eh	the	doctor	could	=n't	seem	to	give	us	a	lot	of	ointments	and	one	thing	and	other	#	and	he	could	=n't	see	seem	to	do	it	any	good,#	and	eh	the	doctor	could	=NEG	seem	to	give	us	a	lot	of	ointments	and	one	thing	and	other	#	and	he	could	=NEG	see	seem	to	do	it	any	good,"And the doctor couldn't seem to give us a lot of ointments or other things, and he couldn't seem to do it any good.",en,MORPHEME_ALIGNED,,kent02_a_mp3 kent02_a_wav kent02_a_eaf kent02_a_xml kent02_a_tsv,,34529,43593,##neg	other	other_dp	ln_det	np.h:a	aux	=neg	nc	nc	v:pred	pro.1:p	ln_deti	np:p2	rn	rn_np	rn	rn_deti	rn_np	rn	rn	#neg	other	pro.h:a	aux	=neg	nc	v:pred	lv_to	vother:other	pro:p	ln_deti	np:obl,,kent02
kent02_0010,mcenglish,And a old gypsy come to - woman with - door with the pegs.,#	and	a	old	gypsy	come	to	woman	with	door	with	the	pegs,#	and	a	old	gypsy	come	to	woman	with	door	with	the	pegs,And an old gypsy came to our door with the pegs.,en,MORPHEME_ALIGNED,,kent02_a_mp3 kent02_a_wav kent02_a_eaf kent02_a_xml kent02_a_tsv,,43593,48005,##	other	ln_deti	ln	np.h:s	v:pred	adp	nc	nc	np:g	adp	ln_det	np:obl,,kent02
kent02_0011,mcenglish,"What's the matter with the boy?, she says.",#	what	='s	the	matter	with	the	boy	#	she	says,#	what	=is	the	matter	with	the	boy	#	she	says,"What's the matter with the boy?, she says.",en,MORPHEME_ALIGNED,,kent02_a_mp3 kent02_a_wav kent02_a_eaf kent02_a_xml kent02_a_tsv,,48005,50703,#ds	inter_pro:s	=cop	ln_det	np:pred	adp	ln_det	np.h:obl	##	pro.h:s_ds	v:pred,,kent02
kent02_0012,mcenglish,"Oh, he had eczema in his eye, she said.",#	oh	he	had	eczema	in	his	eye	#	she	said,#	oh	he	had	eczema	in	his	eye	#	she	said,"Oh, he had eczema in his eye, she said.",en,MORPHEME_ALIGNED,,kent02_a_mp3 kent02_a_wav kent02_a_eaf kent02_a_xml kent02_a_tsv,,50703,53942,#ds	other_dp	pro.h:a	v:pred	np:p	adp	ln_pro.h:poss	np:l	##	pro.h:s_ds	v:pred,,kent02
kent02_0013,mcenglish,"Oh, she says, That's not.",#	oh	she	says	#	that	='s	not	0,#	oh	she	says	#	that	=is	not	0_that,"Oh, she says, That's not.",en,MORPHEME_ALIGNED,,kent02_a_mp3 kent02_a_wav kent02_a_eaf kent02_a_xml kent02_a_tsv,,53942,56304,##	other_dp	pro.h:s_ds	v:pred	#ds.neg	dem_pro:s	=cop	neg	0:pred,,kent02
kent02_0014,mcenglish,"She says, Go to the chemist and get some white copperas, and bathe it, she says, twice a day.",#	she	says	#	go	to	the	chemist	#	and	get	some	white	copperas	#	and	bathe	it	#	she	says	%	twice	a	day,#	she	says	#	go	to	the	chemist	#	and	get	some	white	copperas	#	and	bathe	it	#	she	says	%	twice	a	day,"She says, Go to the chemist and get some white copperas, and bathe it, she says, twice a day.",en,MORPHEME_ALIGNED,,kent02_a_mp3 kent02_a_wav kent02_a_eaf kent02_a_xml kent02_a_tsv,,56304,66408,##	pro.h:s_ds	v:pred	#ds	vother:pred	adp	ln_det	np.h:g	#	other	vother:pred	ln_deti	ln	np:p	#	other	vother:pred	pro:p	#	pro.h:s_ds	v:pred	%	np:other	rn_adp	rn_np,,kent02
kent02_0015,mcenglish,And we done that and it was gone in a fortnight.,#	and	we	done	that	#	and	it	was	gone	in	a	fortnight,#	and	we	done	that	#	and	it	was	gone	in	a	fortnight,And we did that and it was gone in a fortnight.,en,MORPHEME_ALIGNED,,kent02_a_mp3 kent02_a_wav kent02_a_eaf kent02_a_xml kent02_a_tsv,,66408,69774,##	other	pro.1:a	v:pred	dem_pro:p	#	other	pro:s	aux	v:pred	adp	ln_deti	np:other,,kent02
kent02_0016,mcenglish,How do you think about that?,#	how	do	you	think	about	that,#	how	do	you	think	about	that,What do you think about that?,en,MORPHEME_ALIGNED,,kent02_a_mp3 kent02_a_wav kent02_a_eaf kent02_a_xml kent02_a_tsv,,69774,74257,##	inter_pro:other	aux	pro.2:s	v:pred	adp	dem_pro:obl,,kent02
kent02_0017,mcenglish,[INT] Incredible.,[INT]	incredible,[INT]	incredible,[INT] Incredible.,en,MORPHEME_ALIGNED,,kent02_a_mp3 kent02_a_wav kent02_a_eaf kent02_a_xml kent02_a_tsv,,74257,75319,[INT]	nc,,kent02
kent02_0018,mcenglish,That was when I was eight.,#	that	was	#	when	I	was	eight,#	that	was	#	when	I	was	eight,That was when I was eight.,en,MORPHEME_ALIGNED,,kent02_a_mp3 kent02_a_wav kent02_a_eaf kent02_a_xml kent02_a_tsv,,75319,76873,##	dem_pro:s	cop	#ac:pred	other	pro.1:s	cop	np:pred,,kent02
kent02_0019,mcenglish,[INT] Hhm.,[INT]	hhm,[INT]	hhm,[INT] Hhm.,en,MORPHEME_ALIGNED,,kent02_a_mp3 kent02_a_wav kent02_a_eaf kent02_a_xml kent02_a_tsv,,76873,77336,[INT]	nc,,kent02
kent02_0020,mcenglish,And I had it all right down the face.,#	and	I	had	it	all	right	down	the	face,#	and	I	had	it	all	right	down	the	face,And I had it all right down the face.,en,MORPHEME_ALIGNED,,kent02_a_mp3 kent02_a_wav kent02_a_eaf kent02_a_xml kent02_a_tsv,,77336,82823,##	other	pro.1:a	v:pred	pro:p	rn	adp	adp	ln_det	np:l,,kent02
kent02_0021,mcenglish,Hhm.,hhm,hhm,Hhm.,en,MORPHEME_ALIGNED,,kent02_a_mp3 kent02_a_wav kent02_a_eaf kent02_a_xml kent02_a_tsv,,82823,83369,other_dp,,kent02
kent02_0022,mcenglish,[INT] Did people like the gypsies in those days?,[INT]	did	people	like	the	gypsies	in	those	days,[INT]	did	people	like	the	gypsies	in	those	days,[INT] Did people like the gypsies in those days?,en,MORPHEME_ALIGNED,,kent02_a_mp3 kent02_a_wav kent02_a_eaf kent02_a_xml kent02_a_tsv,,83369,85445,[INT]	nc	nc	nc	nc	nc	nc	nc	nc,,kent02
kent02_0023,mcenglish,"Oh, we didn't mind'em.",#	oh	we	did	=n't	mind	='em,#	oh	we	did	=NEG	mind	=them,"Oh, we didn't mind'em.",en,MORPHEME_ALIGNED,,kent02_a_mp3 kent02_a_wav kent02_a_eaf kent02_a_xml kent02_a_tsv,,85445,86369,##neg	other_dp	pro.1:a	aux	=neg	v:pred	=wpro.h:p,,kent02
kent02_0024,mcenglish,"Well, there were some bad gypsies and some good ones there, we had one lot, Charles - name of Charles, used to come and see my dad, and if they'd got a decent pony, they used to bring it and sell it to him.",#	well	there	were	some	bad	gypsies	and	some	good	ones	there	#	we	had	one	lot	Charles	name	of	Charles	#	0	used	to	come	and	see	my	dad	#	and	if	they	='d	got	a	decent	pony	#	they	used	to	bring	it	#	and	0	sell	it	to	him,#	well	there	were	some	bad	gypsies	and	some	good	ones	there	#	we	had	one	lot	Charles	name	of	Charles	#	0_they	used	to	come	and	see	my	dad	#	and	if	they	=had	got	a	decent	pony	#	they	used	to	bring	it	#	and	0_they	sell	it	to	him,"Well, there were some bad gypsies and some good ones there, we had one lot by the name of Charles, they used to come and see my dad, and if they'd got a decent pony, they used to bring it and sell it to him.",en,MORPHEME_ALIGNED,,kent02_a_mp3 kent02_a_wav kent02_a_eaf kent02_a_xml kent02_a_tsv,,86369,98232,##	other_dp	other	other:predex	ln_deti	ln	np.h:s	rn	rn_deti	rn	rn_pro.h	other:l	#	pro.1:a	v:pred	ln_deti	np:p	pn_np.h:appos	nc	nc	nc	#	0.h:s	aux	rv	aux	lv	v:pred	ln_pro.1:poss	np.h:p	#ac	other	other	pro.h:a	=waux	v:pred	ln_deti	ln	np:p	#	pro.h:a	aux	rv	v:pred	pro:p	#	other	0.h:a	v:pred	pro:p	adp	pro.h:g,,kent02
kent02_0025,mcenglish,"I remember they sold him an old grey horse one day, starved of life; he could reall-, he could hardly walk.",#	I	remember	#	they	sold	him	an	old	grey	horse	one	day	#	starved	of	life	#	he	could	reall-	he	could	hardly	walk,#	I	remember	#	they	sold	him	an	old	grey	horse	one	day	#	starved	of	life	#	he	could	reall-	he	could	hardly	walk,"I remember, they sold him an old grey horse one day, which was starved of life; he could hardly walk.",en,MORPHEME_ALIGNED,,kent02_a_mp3 kent02_a_wav kent02_a_eaf kent02_a_xml kent02_a_tsv,,98232,106443,##	pro.1:a	v:pred	#cc:p	pro.h:a	v:pred	pro.h:g	ln_deti	ln	ln	np:p	ln_deti	np:other	#rc	vother:pred	adp	np:obl	#	nc	nc	nc	pro:s	aux	ln	v:pred,,kent02
kent02_0026,mcenglish,"And father says, I don't want that.",#	and	father	says	#	I	don't	want	that,#	and	father	says	#	I	do.NEG	want	that,"And father said, I don't want that.",en,MORPHEME_ALIGNED,,kent02_a_mp3 kent02_a_wav kent02_a_eaf kent02_a_xml kent02_a_tsv,,106443,109403,##	other	np.h:s_ds	v:pred	#ds.neg	pro.1:a	aux_neg	v:pred	dem_pro:p,,kent02
kent02_0027,mcenglish,"He says, Give us a fiver for it, Edward, and you can have it.",#	he	says	#	give	us	a	fiver	for	it	Edward	#	and	you	can	have	it,#	he	says	#	give	us	a	fiver	for	it	Edward	#	and	you	can	have	it,"The gypsy said, Give us a fiver for it, Edward, and you can have it.",en,MORPHEME_ALIGNED,,kent02_a_mp3 kent02_a_wav kent02_a_eaf kent02_a_xml kent02_a_tsv,,109403,113539,##	pro.h:s_ds	v:pred	#ds	vother:pred	pro.1:p	ln_deti	np:p2	adp	pro:obl	pn_np.h:voc	#	other	pro.2:a	aux	vother:pred	pro:p,,kent02
kent02_0028,mcenglish,And so father gave him a fiver for this horse.,#	and	so	father	gave	him	a	fiver	for	this	horse,#	and	so	father	gave	him	a	fiver	for	this	horse,And so father gave him a fiver for this horse.,en,MORPHEME_ALIGNED,,kent02_a_mp3 kent02_a_wav kent02_a_eaf kent02_a_xml kent02_a_tsv,,113539,116643,##	other	other	np.h:a	v:pred	pro.h:p	ln_deti	np:p2	adp	ln_dem	np:obl,,kent02
kent02_0029,mcenglish,"And eh, we nursed him up, and got him to be in good condition.",#	and	eh	we	nursed	him	up	#	and	0	got	him	to	be	in	good	condition,#	and	eh	we	nursed	him	up	#	and	0_we	got	him	to	be	in	good	condition,"And we nursed him up, and got him to be in good condition.",en,MORPHEME_ALIGNED,,kent02_a_mp3 kent02_a_wav kent02_a_eaf kent02_a_xml kent02_a_tsv,,116643,124684,##	other	other_dp	pro.1:a	v:pred	pro:p	rv	#	other	0.1:a	v:pred	pro:obl	lv_to	vother:other	adp	ln	np:obl,,kent02
kent02_0030,mcenglish,We sold him to the Earl Sourstone to this farm just at - next door to me.,#	we	sold	him	to	the	Earl Sourstone	to	this	farm	just	at	next	door	to	me,#	we	sold	him	to	the	Earl.Sourstone	to	this	farm	just	at	next	door	to	me,"We sold him to the Earl Sourstone, to this farm just next door to me.",en,MORPHEME_ALIGNED,,kent02_a_mp3 kent02_a_wav kent02_a_eaf kent02_a_xml kent02_a_tsv,,124684,132822,##	pro.1:a	v:pred	pro:p	adp	ln_det	np.h:g	adp	ln_dem	np:g	other	adp	ln	np:l	adp	pro.1:obl,,kent02
kent02_0031,mcenglish,"And eh, about three years afterwards, I didn't live here, mind then, mind you; I lived at Molash.",#	and	eh	about	three	years	afterwards	I	did	=n't	live	here	mind	then	mind	you	#	I	lived	at	Molash,#	and	eh	about	three	years	afterwards	I	did	=NEG	live	here	mind	then	mind	you	#	I	lived	at	Molash,And about three years afterwards- I didn't live here then mind you; I lived at Molash.,en,MORPHEME_ALIGNED,,kent02_a_mp3 kent02_a_wav kent02_a_eaf kent02_a_xml kent02_a_tsv,,132822,142571,##neg	nc	nc	nc	nc	nc	nc	pro.1:s	aux	=neg	v:pred	other:l	other_dp	other	other_dp	other_dp	#	pro.1:s	v:pred	adp	pn_np:l,,kent02
kent02_0032,mcenglish,Three years afterwards - what?,#	three	years	afterwards	what,#	three	years	afterwards	what,Three years afterwards- what?,en,MORPHEME_ALIGNED,,kent02_a_mp3 kent02_a_wav kent02_a_eaf kent02_a_xml kent02_a_tsv,,142571,144689,#nc	nc	nc	nc	nc,,kent02
kent02_0033,mcenglish,"[INT] What, how old were you then, about?",[INT]	what	how	old	were	you	then	about,[INT]	what	how	old	were	you	then	about,"[INT] How old were you then, about?",en,MORPHEME_ALIGNED,,kent02_a_mp3 kent02_a_wav kent02_a_eaf kent02_a_xml kent02_a_tsv,,144689,146506,[INT]	nc	nc	nc	nc	nc	nc	nc,,kent02
kent02_0034,mcenglish,"I was eleven, about eleven or twelve.",#	I	was	eleven	about	eleven	or	twelve,#	I	was	eleven	about	eleven	or	twelve,"I was eleven, about eleven or twelve.",en,MORPHEME_ALIGNED,,kent02_a_mp3 kent02_a_wav kent02_a_eaf kent02_a_xml kent02_a_tsv,,146506,149319,##	pro.1:s	cop	np:pred	rn_adp	np:other	rn	rn,,kent02
kent02_0035,mcenglish,[INT] Hhm.,[INT]	hhm,[INT]	hhm,[INT] Hhm.,en,MORPHEME_ALIGNED,,kent02_a_mp3 kent02_a_wav kent02_a_eaf kent02_a_xml kent02_a_tsv,,149319,149579,[INT]	nc,,kent02
kent02_0036,mcenglish,"Father had a letter, from a Ba- man named Barnes, Street End Farm - they still got it, ain't they?",#	father	had	a	letter	from	a	Ba-	man	#	named	Barnes	#	Street End Farm	they	still	got	it	ain't	they,#	father	had	a	letter	from	a	Ba-	man	#	named	Barnes	#	Street.End.Farm	they	still	got	it	do.NEG	they,"Father had a letter, from a man named Barnes, at Street End Farm - they still got it, don't they?",en,MORPHEME_ALIGNED,,kent02_a_mp3 kent02_a_wav kent02_a_eaf kent02_a_xml kent02_a_tsv,,149579,159436,##	pro.h:a	v:pred	ln_deti	np:p	adp	ln_deti	nc	np.h:obl	#rc	vother:pred	pn_np:p	#	pn_np:dt_p	pro.h:a	other	v:pred	pro:p	other_tag	other,,kent02
kent02_0037,mcenglish,Do you know of'em?,#	do	you	know	of	='em,#	do	you	know	of	=them,Do you know of'em?,en,MORPHEME_ALIGNED,,kent02_a_mp3 kent02_a_wav kent02_a_eaf kent02_a_xml kent02_a_tsv,,159436,160218,##	aux	pro.2:s	v:pred	rv_adp	=wpro.h:obl,,kent02
kent02_0038,mcenglish,[INT] Hhm.,[INT]	hhm,[INT]	hhm,[INT] Hhm.,en,MORPHEME_ALIGNED,,kent02_a_mp3 kent02_a_wav kent02_a_eaf kent02_a_xml kent02_a_tsv,,160218,160613,[INT]	nc,,kent02
kent02_0039,mcenglish,She was going to Germany.,#	she	was	going	to	Germany,#	she	was	going	to	Germany,She was going to Germany.,en,MORPHEME_ALIGNED,,kent02_a_mp3 kent02_a_wav kent02_a_eaf kent02_a_xml kent02_a_tsv,,160613,163535,##	pro.h:s	aux	v:pred	adp	pn_np:g,,kent02
kent02_0040,mcenglish,"And eh, she wanted Lord Sourstone, the Earl of Sourstone really, except that we always called him Lord, he but he's Earl, really.",#	and	eh	she	wanted	Lord Sourstone	the	Earl	of	Sourstone	really	#	except	that	we	always	called	him	Lord	#	he	but	he	='s	Earl	really,#	and	eh	she	wanted	Lord.Sourstone	the	Earl	of	Sourstone	really	#	except	that	we	always	called	him	Lord	#	he	but	he	=is	Earl	really,"And she wanted Lord Sourstone - the Earl of Sourstone really, except that we always called him Lord, he but he's Earl, really.",en,MORPHEME_ALIGNED,,kent02_a_mp3 kent02_a_wav kent02_a_eaf kent02_a_xml kent02_a_tsv,,163535,173927,##	other	other_dp	pro.h:a	v:pred	pn_np:p	ln_det	np.h:appos	rn_of	rn_pn	other	#	other	other	pro.1:a	other	v:pred	pro.h:p	np.h:p2	#	nc	nc	pro.h:s	=cop	np.h:pred	other,,kent02
kent02_0041,mcenglish,"If he'd have this horse back, 'cause she didn't want to sell him, she wanted eh him to have a good home all his life.",#	if	he	='d	have	this	horse	back	#	'cause	she	did	=n't	want	to	sell	him	#	she	wanted	eh	him	to	have	a	good	home	all	his	life,#	if	he	=would	have	this	horse	back	#	because	she	did	=NEG	want	to	sell	him	#	she	wanted	eh	him	to	have	a	good	home	all	his	life,"She asked him If he'd have this horse back, because she didn't want to sell him, she wanted eh him to have a good home all his life.",en,MORPHEME_ALIGNED,,kent02_a_mp3 kent02_a_wav kent02_a_eaf kent02_a_xml kent02_a_tsv,,173927,180844,#ac	other	pro.h:a	=waux	v:pred	ln_dem	np:p	rv	#ac.neg	other	pro.h:a	aux	=neg	aux	lv_to	v:pred	pro.h:p	##	pro.h:a	v:pred	other_dp	pro:obl	lv_to	vother:other	ln_deti	ln	np:p	ln_det	ln_pro:poss	np:other,,kent02
kent02_0042,mcenglish,"And eh, he said, No, I don't want him.",#	and	eh	he	said	#	no	I	don't	want	him,#	and	eh	he	said	#	no	I	do.NEG	want	him,"And he said, No, I don't want him.",en,MORPHEME_ALIGNED,,kent02_a_mp3 kent02_a_wav kent02_a_eaf kent02_a_xml kent02_a_tsv,,180844,184332,##	other	other_dp	pro.h:s_ds	v:pred	#ds.neg	other_dp	pro.1:a	aux_neg	v:pred	pro:p,,kent02
kent02_0043,mcenglish,"Says, You send him to Edward Crown.",#	0	says	#	you	send	him	to	Edward Crown,#	0_he	says	#	you	send	him	to	Edward.Crown,"He said, You send him to Edward Crown.",en,MORPHEME_ALIGNED,,kent02_a_mp3 kent02_a_wav kent02_a_eaf kent02_a_xml kent02_a_tsv,,184332,186835,##	0.h:s_ds	v:pred	#ds	pro.2:a	v:pred	pro:p	adp	pn_np:g,,kent02
kent02_0044,mcenglish,"He saved his life, he said, He'd like to have him.",#	he	saved	his	life	#	he	said	#	he	='d	like	to	have	him,#	he	saved	his	life	#	he	said	#	he	=would	like	to	have	him,"He saved his life, he said, He'd like to have him.",en,MORPHEME_ALIGNED,,kent02_a_mp3 kent02_a_wav kent02_a_eaf kent02_a_xml kent02_a_tsv,,186835,189800,#ds	pro.h:a	v:pred	ln_pro:poss	np:p	##	pro.h:s_ds	v:pred	#ds	pro.h:a	=waux	v:pred	lv_to	vother:other	pro:p,,kent02
kent02_0045,mcenglish,"So eh, sh- sh- she wrote to my father; we went over there, to see her - ponycart, and eh, she said, Now, she says, I'm going to give you that horse on conditions you never sell him; you keep him till he dies, or have him put down.",#	so	eh	sh-	sh-	she	wrote	to	my	father	#	we	went	over	there	#	to	see	her	ponycart	#	and	eh	she	said	#	now	#	she	says	%	I	='m	going	to	give	you	that	horse	#	on	conditions	you	never	sell	him	#	you	keep	him	#	till	he	dies	#	or	0	have	him	put	down,#	so	eh	sh-	sh-	she	wrote	to	my	father	#	we	went	over	there	#	to	see	her	ponycart	#	and	eh	she	said	#	now	#	she	says	%	I	=am	going	to	give	you	that	horse	#	on	conditions	you	never	sell	him	#	you	keep	him	#	till	he	dies	#	or	0_you	have	him	put	down,"So she wrote to my father; we went over there, to see her, with a ponycart, and she said, Now, I'm going to give you that horse on conditions you never sell him; you keep him until he dies, or have him put down.",en,MORPHEME_ALIGNED,,kent02_a_mp3 kent02_a_wav kent02_a_eaf kent02_a_xml kent02_a_tsv,,189800,209913,##	other	other_dp	nc	nc	pro.h:s	v:pred	adp	ln_pro.1:poss	np.h:g	#	pro.1:s	v:pred	adp	other:g	#ac	lv_to	vother:pred	pro.h:p	other	#	other	other_dp	pro.h:s_ds	v:pred	#ds	other	#	pro.h:s_ds	v:pred	%	pro.1:a	=waux	aux	lv_to	v:pred	pro.2:p	ln_dem	np:p2	#ac.neg	other	other	pro.2:a	lv_neg	v:pred	pro.h:p	#	pro.2:a	v:pred	pro:p	#ac	other	pro:s	v:pred	#	other	0.2:a	v:pred	pro:p	vother:other	rv_adp,,kent02
kent02_0046,mcenglish,"She says, And you can have his this cart and the harness and everything with him.",#	she	says	#	and	you	can	have	his	this	cart	and	the	harness	and	everything	with	him,#	she	says	#	and	you	can	have	his	this	cart	and	the	harness	and	everything	with	him,"She says, And you can have his this cart and the harness and everything with him.",en,MORPHEME_ALIGNED,,kent02_a_mp3 kent02_a_wav kent02_a_eaf kent02_a_xml kent02_a_tsv,,209913,215901,##	pro.h:s_ds	v:pred	#ds	other	pro.2:a	aux	v:pred	ln_pro:poss	ln_dem	np:p	rn	rn_det	rn_np	rn	rn	adp	pro:obl,,kent02
